{
  "schema_version": "2.0",
  "request_id": "fixture-tick-001",
  "mode": "tick_then_bar",
  "timeline": {"time_col": "ts_local_us", "timezone": "UTC"},
  "sources": [
    {
      "name": "quotes",
      "inline_rows": [
        {
          "ts_local_us": 10000000,
          "exchange_id": 1,
          "symbol_id": 12345,
          "bid_px_int": 50000,
          "ask_px_int": 50005,
          "file_id": 1,
          "file_line_number": 1
        },
        {
          "ts_local_us": 20000000,
          "exchange_id": 1,
          "symbol_id": 12345,
          "bid_px_int": 50010,
          "ask_px_int": 50015,
          "file_id": 1,
          "file_line_number": 2
        }
      ]
    }
  ],
  "spine": {"type": "clock", "step_ms": 60000, "start_ts_us": 0, "end_ts_us": 120000000},
  "operators": [
    {
      "name": "spread_stats",
      "output_name": "spread_stats",
      "stage": "feature_then_aggregate",
      "source_column": "bid_px_int",
      "agg": "spread_distribution",
      "required_columns": ["ask_px_int", "bid_px_int"],
      "mode_allowlist": ["HFT", "MFT"],
      "pit_policy": {"feature_direction": "backward_only"},
      "determinism_policy": {"required_sort": ["exchange_id", "symbol_id", "ts_local_us"], "stateful": false},
      "impl_ref": "pointline.research.resample.aggregations.microstructure.spread_distribution",
      "version": "2.0"
    }
  ],
  "labels": [],
  "evaluation": {"metrics": ["row_count"], "split_method": "fixed"},
  "constraints": {
    "pit_timeline": "ts_local_us",
    "forbid_lookahead": true,
    "cost_model": {"fees_bps": 1.0, "slippage_bps": 2.0}
  },
  "artifacts": {"include_artifacts": false}
}
