{
  "schema_version": "2.0",
  "request_id": "fixture-event-001",
  "mode": "event_joined",
  "timeline": {"time_col": "ts_local_us", "timezone": "UTC"},
  "sources": [
    {
      "name": "trades",
      "inline_rows": [
        {
          "ts_local_us": 10000000,
          "exchange_id": 1,
          "symbol_id": 12345,
          "qty_int": 100,
          "px_int": 50000,
          "side": 0,
          "file_id": 1,
          "file_line_number": 1
        },
        {
          "ts_local_us": 70000000,
          "exchange_id": 1,
          "symbol_id": 12345,
          "qty_int": 200,
          "px_int": 50010,
          "side": 1,
          "file_id": 1,
          "file_line_number": 2
        }
      ]
    },
    {
      "name": "quotes",
      "inline_rows": [
        {
          "ts_local_us": 9000000,
          "exchange_id": 1,
          "symbol_id": 12345,
          "bid_px_int": 49995,
          "ask_px_int": 50005,
          "file_id": 2,
          "file_line_number": 9
        },
        {
          "ts_local_us": 60000000,
          "exchange_id": 1,
          "symbol_id": 12345,
          "bid_px_int": 50005,
          "ask_px_int": 50020,
          "file_id": 2,
          "file_line_number": 10
        }
      ]
    }
  ],
  "spine": {"type": "trades", "source": "trades"},
  "operators": [],
  "labels": [],
  "evaluation": {"metrics": ["row_count"], "split_method": "fixed"},
  "constraints": {
    "pit_timeline": "ts_local_us",
    "forbid_lookahead": true,
    "cost_model": {"fees_bps": 1.0, "slippage_bps": 2.0}
  },
  "artifacts": {"include_artifacts": false}
}
